{"$defs":{"componentId":{"enum":["pkg:oci/argoproj/argo-cd","pkg:oci/argoproj/argo-workflows","pkg:oci/cert-manager/cert-manager","pkg:oci/prometheus/prometheus"]},"digest":{"pattern":"^sha256:[0-9a-f]{64}$","type":"string"},"packageUnknown":{"additionalProperties":false,"properties":{"authority":{"const":"BRANCH_COVERAGE_ONLY_NO_COMPATIBILITY_CLAIM"},"nextAction":{"minLength":1,"type":"string"},"outcome":{"const":"UNKNOWN"},"predicateId":{"const":"package.takedown_status"},"reason":{"const":"knowledge revision takedown status is NOT_ASSESSED; target tags require an official yank/takedown check"},"reasonClass":{"const":"PACKAGE_TAKEDOWN_NOT_ASSESSED"},"registerDigest":{"$ref":"#/$defs/digest"},"registerPath":{"const":"yank-takedown.json"},"revisionId":{"const":"2026-09-01-community-v3"},"sourceReceiptIds":{"items":{"type":"string"},"maxItems":0,"type":"array"},"sourceSpanDigests":{"items":{"$ref":"#/$defs/digest"},"maxItems":0,"type":"array"},"sourceSpanIds":{"items":{"type":"string"},"maxItems":0,"type":"array"},"targetTags":{"items":{"type":"string"},"maxItems":4,"minItems":4,"type":"array","uniqueItems":true}},"required":["authority","nextAction","outcome","predicateId","reason","reasonClass","registerDigest","registerPath","revisionId","sourceReceiptIds","sourceSpanDigests","sourceSpanIds","targetTags"],"type":"object"},"predicateId":{"enum":["component.argo_cd.insecure_server_enabled","component.argo_cd.repo_server_configured","component.argo_workflows.namespaced_mode","component.argo_workflows.managed_namespace_configured","component.cert_manager.dns01_recursive_nameservers_configured","component.cert_manager.feature_gate_acme_use_ari","component.cert_manager.feature_gate_ca_injector_merging","component.cert_manager.feature_gate_certificate_request_controllers","component.cert_manager.feature_gate_experimental_gateway_api_support","component.cert_manager.feature_gate_listener_sets","component.cert_manager.feature_gate_other_names","component.cert_manager.feature_gate_server_side_apply","component.cert_manager.owner_ref_enabled","component.prometheus.log_level","component.prometheus.web_admin_api_enabled","component.prometheus.web_lifecycle_enabled"]},"semver":{"maxLength":256,"pattern":"^(0|[1-9][0-9]*)\\.(0|[1-9][0-9]*)\\.(0|[1-9][0-9]*)(?:-(?:0|[1-9][0-9]*|[0-9]*[A-Za-z-][0-9A-Za-z-]*)(?:\\.(?:0|[1-9][0-9]*|[0-9]*[A-Za-z-][0-9A-Za-z-]*))*)?(?:\\+[0-9A-Za-z-]+(?:\\.[0-9A-Za-z-]+)*)?$","type":"string"}},"$id":"prufyx.io/synthetic-snapshot-factory/expected-oracle/v4","$schema":"https://json-schema.org/draft/2020-12/schema","additionalProperties":false,"allOf":[{"if":{"properties":{"observationImport":{"properties":{"outcome":{"const":"ACCEPT"}},"type":"object"}},"type":"object"},"then":{"properties":{"observationImport":{"properties":{"reasonClass":{"const":"NONE"}},"type":"object"}},"type":"object"}},{"if":{"properties":{"observationImport":{"properties":{"outcome":{"const":"REJECT"}},"type":"object"}},"type":"object"},"then":{"properties":{"currentBundle":{"type":"null"},"evaluator":{"type":"null"},"observationImport":{"properties":{"reasonClass":{"enum":["INVALID","INTEGRITY","AMBIGUOUS","RESOURCE_LIMIT","UNSUPPORTED_PLATFORM"]}},"type":"object"}},"type":"object"}}],"properties":{"authority":{"const":"BRANCH_COVERAGE_ONLY_NO_COMPATIBILITY_CLAIM"},"compatibilityEvidenceEligible":{"const":false},"currentBundle":{"oneOf":[{"type":"null"},{"additionalProperties":false,"properties":{"authority":{"const":"LOCAL_MANIFEST_INTEGRITY_ONLY"},"componentStates":{"items":{"additionalProperties":false,"properties":{"componentId":{"$ref":"#/$defs/componentId"},"version":{"$ref":"#/$defs/semver"},"versionState":{"enum":["exact","unknown","conflict"]}},"required":["componentId","versionState"],"type":"object"},"maxItems":256,"type":"array"},"evaluationEligible":{"const":false},"requiredOmissionCodes":{"items":{"pattern":"^[A-Z][A-Z0-9_]{2,127}$","type":"string"},"maxItems":256,"type":"array","uniqueItems":true}},"required":["authority","evaluationEligible","componentStates","requiredOmissionCodes"],"type":"object"}]},"evaluator":{"oneOf":[{"type":"null"},{"additionalProperties":false,"properties":{"aggregate":{"enum":["NOT_RUN","UNKNOWN"]},"authority":{"const":"BRANCH_COVERAGE_ONLY_NO_COMPATIBILITY_CLAIM"},"executionAllowed":{"type":"boolean"},"predicateOutcomes":{"items":{"additionalProperties":false,"properties":{"componentId":{"$ref":"#/$defs/componentId"},"nextAction":{"minLength":1,"type":"string"},"outcome":{"enum":["MATCH","MISMATCH","UNKNOWN"]},"predicateId":{"$ref":"#/$defs/predicateId"},"reason":{"minLength":1,"type":"string"},"reasonClass":{"pattern":"^[A-Z][A-Z0-9_]{1,127}$","type":"string"}},"required":["componentId","predicateId","outcome","reason","nextAction","reasonClass"],"type":"object"},"maxItems":16384,"type":"array"}},"required":["executionAllowed","aggregate","predicateOutcomes","authority"],"type":"object"}]},"evaluatorContractDigest":{"$ref":"#/$defs/digest"},"kind":{"const":"SyntheticSnapshotExpectedOracle"},"observationImport":{"additionalProperties":false,"properties":{"outcome":{"enum":["ACCEPT","REJECT"]},"reasonClass":{"enum":["NONE","INVALID","INTEGRITY","AMBIGUOUS","RESOURCE_LIMIT","UNSUPPORTED_PLATFORM"]}},"required":["outcome","reasonClass"],"type":"object"},"oracleDigest":{"$ref":"#/$defs/digest"},"packageUnknown":{"oneOf":[{"type":"null"},{"$ref":"#/$defs/packageUnknown"}]},"rejectionClass":{"enum":["NONE","FRESHNESS","CONFLICT","INTEGRITY"]},"rejectionNextAction":{"anyOf":[{"minLength":1,"type":"string"},{"type":"null"}]},"rejectionReason":{"anyOf":[{"minLength":1,"type":"string"},{"type":"null"}]},"releaseEvidenceEligible":{"const":false},"scenarioDigest":{"$ref":"#/$defs/digest"},"scenarioId":{"pattern":"^syn-[a-z0-9](?:[a-z0-9-]{0,62}[a-z0-9])?$","type":"string"},"schema":{"const":"prufyx.io/synthetic-snapshot-factory/expected-oracle/v4"},"sourceRevision":{"const":"synthetic-snapshot-factory-v4"}},"required":["schema","kind","scenarioId","scenarioDigest","sourceRevision","evaluatorContractDigest","authority","observationImport","currentBundle","evaluator","compatibilityEvidenceEligible","releaseEvidenceEligible","rejectionClass","rejectionReason","rejectionNextAction","oracleDigest","packageUnknown"],"title":"Prufyx synthetic snapshot expected behavior oracle","type":"object"}
