{"authority":"BRANCH_COVERAGE_ONLY_NO_COMPATIBILITY_CLAIM","compatibilityEvidenceEligible":false,"currentBundle":{"authority":"LOCAL_MANIFEST_INTEGRITY_ONLY","componentStates":[{"componentId":"pkg:oci/argoproj/argo-cd","version":"3.5.2","versionState":"exact"},{"componentId":"pkg:oci/argoproj/argo-workflows","version":"4.1.2","versionState":"exact"},{"componentId":"pkg:oci/cert-manager/cert-manager","version":"1.21.1","versionState":"exact"},{"componentId":"pkg:oci/prometheus/prometheus","version":"3.14.0","versionState":"exact"}],"evaluationEligible":false,"requiredOmissionCodes":[]},"evaluator":{"aggregate":"UNKNOWN","authority":"BRANCH_COVERAGE_ONLY_NO_COMPATIBILITY_CLAIM","executionAllowed":false,"predicateOutcomes":[{"componentId":"pkg:oci/argoproj/argo-cd","nextAction":"No compatibility conclusion is available from this context match","outcome":"MATCH","predicateId":"component.argo_cd.insecure_server_enabled","reason":"exact source- and role-bound context observation matches; this is not compatibility evidence","reasonClass":"CONTEXT_MATCH_NON_AUTHORITATIVE"},{"componentId":"pkg:oci/argoproj/argo-cd","nextAction":"Review the customer-owned role configuration against the cited source boundary","outcome":"MISMATCH","predicateId":"component.argo_cd.repo_server_configured","reason":"observed role-bound value differs from the reviewed context predicate","reasonClass":"CONTEXT_MISMATCH_ATTENTION"},{"componentId":"pkg:oci/argoproj/argo-workflows","nextAction":"Inspect the current role configuration for predicate component.argo_workflows.managed_namespace_configured","outcome":"UNKNOWN","predicateId":"component.argo_workflows.managed_namespace_configured","reason":"missing exact observed value for predicate component.argo_workflows.managed_namespace_configured in role-bound configuration","reasonClass":"MISSING_OR_UNSUPPORTED_CONTEXT"},{"componentId":"pkg:oci/argoproj/argo-workflows","nextAction":"Inspect the current role configuration for predicate component.argo_workflows.namespaced_mode","outcome":"UNKNOWN","predicateId":"component.argo_workflows.namespaced_mode","reason":"missing exact observed value for predicate component.argo_workflows.namespaced_mode in role-bound configuration","reasonClass":"MISSING_OR_UNSUPPORTED_CONTEXT"},{"componentId":"pkg:oci/cert-manager/cert-manager","nextAction":"Inspect the current role configuration for predicate component.cert_manager.dns01_recursive_nameservers_configured","outcome":"UNKNOWN","predicateId":"component.cert_manager.dns01_recursive_nameservers_configured","reason":"missing exact observed value for predicate component.cert_manager.dns01_recursive_nameservers_configured in role-bound configuration","reasonClass":"MISSING_OR_UNSUPPORTED_CONTEXT"},{"componentId":"pkg:oci/cert-manager/cert-manager","nextAction":"Inspect the current role configuration for predicate component.cert_manager.feature_gate_acme_use_ari","outcome":"UNKNOWN","predicateId":"component.cert_manager.feature_gate_acme_use_ari","reason":"missing exact observed value for predicate component.cert_manager.feature_gate_acme_use_ari in role-bound configuration","reasonClass":"MISSING_OR_UNSUPPORTED_CONTEXT"},{"componentId":"pkg:oci/cert-manager/cert-manager","nextAction":"Obtain a separately reviewed source-backed predicate definition","outcome":"UNKNOWN","predicateId":"component.cert_manager.feature_gate_ca_injector_merging","reason":"predicate is explicitly unsupported by the reviewed revision","reasonClass":"UNSUPPORTED_PREDICATE"},{"componentId":"pkg:oci/cert-manager/cert-manager","nextAction":"Inspect the current role configuration for predicate component.cert_manager.feature_gate_certificate_request_controllers","outcome":"UNKNOWN","predicateId":"component.cert_manager.feature_gate_certificate_request_controllers","reason":"missing exact observed value for predicate component.cert_manager.feature_gate_certificate_request_controllers in role-bound configuration","reasonClass":"MISSING_OR_UNSUPPORTED_CONTEXT"},{"componentId":"pkg:oci/cert-manager/cert-manager","nextAction":"Inspect the current role configuration for predicate component.cert_manager.feature_gate_experimental_gateway_api_support","outcome":"UNKNOWN","predicateId":"component.cert_manager.feature_gate_experimental_gateway_api_support","reason":"missing exact observed value for predicate component.cert_manager.feature_gate_experimental_gateway_api_support in role-bound configuration","reasonClass":"MISSING_OR_UNSUPPORTED_CONTEXT"},{"componentId":"pkg:oci/cert-manager/cert-manager","nextAction":"Inspect the current role configuration for predicate component.cert_manager.feature_gate_listener_sets","outcome":"UNKNOWN","predicateId":"component.cert_manager.feature_gate_listener_sets","reason":"missing exact observed value for predicate component.cert_manager.feature_gate_listener_sets in role-bound configuration","reasonClass":"MISSING_OR_UNSUPPORTED_CONTEXT"},{"componentId":"pkg:oci/cert-manager/cert-manager","nextAction":"Inspect the current role configuration for predicate component.cert_manager.feature_gate_other_names","outcome":"UNKNOWN","predicateId":"component.cert_manager.feature_gate_other_names","reason":"missing exact observed value for predicate component.cert_manager.feature_gate_other_names in role-bound configuration","reasonClass":"MISSING_OR_UNSUPPORTED_CONTEXT"},{"componentId":"pkg:oci/cert-manager/cert-manager","nextAction":"Inspect the current role configuration for predicate component.cert_manager.feature_gate_server_side_apply","outcome":"UNKNOWN","predicateId":"component.cert_manager.feature_gate_server_side_apply","reason":"missing exact observed value for predicate component.cert_manager.feature_gate_server_side_apply in role-bound configuration","reasonClass":"MISSING_OR_UNSUPPORTED_CONTEXT"},{"componentId":"pkg:oci/cert-manager/cert-manager","nextAction":"Inspect the current role configuration for predicate component.cert_manager.owner_ref_enabled","outcome":"UNKNOWN","predicateId":"component.cert_manager.owner_ref_enabled","reason":"missing exact observed value for predicate component.cert_manager.owner_ref_enabled in role-bound configuration","reasonClass":"MISSING_OR_UNSUPPORTED_CONTEXT"},{"componentId":"pkg:oci/prometheus/prometheus","nextAction":"Inspect the current role configuration for predicate component.prometheus.log_level","outcome":"UNKNOWN","predicateId":"component.prometheus.log_level","reason":"missing exact observed value for predicate component.prometheus.log_level in role-bound configuration","reasonClass":"MISSING_OR_UNSUPPORTED_CONTEXT"},{"componentId":"pkg:oci/prometheus/prometheus","nextAction":"Inspect the current role configuration for predicate component.prometheus.web_admin_api_enabled","outcome":"UNKNOWN","predicateId":"component.prometheus.web_admin_api_enabled","reason":"missing exact observed value for predicate component.prometheus.web_admin_api_enabled in role-bound configuration","reasonClass":"MISSING_OR_UNSUPPORTED_CONTEXT"},{"componentId":"pkg:oci/prometheus/prometheus","nextAction":"Inspect the current role configuration for predicate component.prometheus.web_lifecycle_enabled","outcome":"UNKNOWN","predicateId":"component.prometheus.web_lifecycle_enabled","reason":"missing exact observed value for predicate component.prometheus.web_lifecycle_enabled in role-bound configuration","reasonClass":"MISSING_OR_UNSUPPORTED_CONTEXT"}]},"evaluatorContractDigest":"sha256:64e01db17daf4b57aeced2217b7f652242f99f460876e9e085a0ded413ad9d4b","kind":"SyntheticSnapshotExpectedOracle","observationImport":{"outcome":"ACCEPT","reasonClass":"NONE"},"oracleDigest":"sha256:0cc5c35330804799891a09747d2b8f41736d6ed1ecae91b76bc5b2cfb3625533","packageUnknown":{"authority":"BRANCH_COVERAGE_ONLY_NO_COMPATIBILITY_CLAIM","nextAction":"Check official yank/takedown status for: v3.5.2, v4.1.2, v1.21.1, v3.14.0","outcome":"UNKNOWN","predicateId":"package.takedown_status","reason":"knowledge revision takedown status is NOT_ASSESSED; target tags require an official yank/takedown check","reasonClass":"PACKAGE_TAKEDOWN_NOT_ASSESSED","registerDigest":"sha256:c4b988734d913c2d6e11dd355b86b45037cc6f1d41fa5d68e40adda1eb1885d7","registerPath":"yank-takedown.json","revisionId":"2026-09-01-community-v3","sourceReceiptIds":[],"sourceSpanDigests":[],"sourceSpanIds":[],"targetTags":["v3.5.2","v4.1.2","v1.21.1","v3.14.0"]},"rejectionClass":"NONE","rejectionNextAction":null,"rejectionReason":null,"releaseEvidenceEligible":false,"scenarioDigest":"sha256:3ea930b6802ffd4ac3be40070a2bee77a4bca49effb660eee9ead45f3586edd2","scenarioId":"syn-v4-config-mismatch-attention","schema":"prufyx.io/synthetic-snapshot-factory/expected-oracle/v4","sourceRevision":"synthetic-snapshot-factory-v4"}
