{"authority":"BRANCH_COVERAGE_ONLY_NO_COMPATIBILITY_CLAIM","compatibilityEvidenceEligible":false,"currentBundle":{"authority":"LOCAL_MANIFEST_INTEGRITY_ONLY","componentStates":[{"componentId":"pkg:oci/argoproj/argo-cd","versionState":"conflict"},{"componentId":"pkg:oci/argoproj/argo-workflows","version":"4.1.2","versionState":"exact"},{"componentId":"pkg:oci/cert-manager/cert-manager","version":"1.21.1","versionState":"exact"},{"componentId":"pkg:oci/prometheus/prometheus","version":"3.14.0","versionState":"exact"}],"evaluationEligible":false,"requiredOmissionCodes":["CONFIGURATION_PARTIAL"]},"evaluator":null,"evaluatorContractDigest":"sha256:64e01db17daf4b57aeced2217b7f652242f99f460876e9e085a0ded413ad9d4b","kind":"SyntheticSnapshotExpectedOracle","observationImport":{"outcome":"ACCEPT","reasonClass":"NONE"},"oracleDigest":"sha256:b8370e99dc7a71cf0946ca548501bb364d7584ab015e9f735de99eb3473857f1","packageUnknown":null,"rejectionClass":"CONFLICT","rejectionNextAction":"Resolve the conflicting component versions before evaluation","rejectionReason":"component version observations conflict; current bundle is not evaluation-ready","releaseEvidenceEligible":false,"scenarioDigest":"sha256:a9f51a4cf096863437aa9350b2e5d3954fee64a9c09e232a384637a1ff8f7a46","scenarioId":"syn-v4-conflicting-argo-cd-versions","schema":"prufyx.io/synthetic-snapshot-factory/expected-oracle/v4","sourceRevision":"synthetic-snapshot-factory-v4"}
